{"channel":"stable","compositions":[{"channel":"stable","components":[{"identity":"engineering-platform-server","requires_capabilities":["composition/v3","provider-targets/v1","system-launchdaemon/v1"]}],"composition_id":"ep-only-2.3.106","manifest":{"digest":"sha256:ba7fe2e16e92ba6b9388895691c7f33c386be51b5538ed591141aa917c2d6601","url":"https://github.com/autonomous-engineering-system/forge-platform/releases/download/forge-platform-composition-catalog-v1/ForgePlatformComposition-1-1.json"},"requires_installer":{"capabilities":["catalog-component-set/v1","composition/v3","managed-deployment/v1","managed-python-runtime/v1","provider-fanout/v1","provider-gate/v1","provider-targets/v1","system-launchdaemon/v1"],"minimum_version":"0.3.0"},"selection_sequence":1,"upgrade_from":[]},{"channel":"stable","components":[{"identity":"engineering-platform-server","requires_capabilities":["composition/v3","provider-targets/v1","system-launchdaemon/v1"]},{"identity":"forge-runtime","requires_capabilities":["composition/v3","provider-targets/v1","system-launchdaemon/v1"]}],"composition_id":"forge-ep-2.7.39-2.3.106","manifest":{"digest":"sha256:d5bcb7df9081884b4587b7c57f216a334b5f26163ac9b4f1884d029f760f586e","url":"https://github.com/autonomous-engineering-system/forge-platform/releases/download/forge-platform-composition-catalog-v1/ForgePlatformComposition-1-2.json"},"requires_installer":{"capabilities":["catalog-component-set/v1","composition/v3","managed-deployment/v1","managed-python-runtime/v1","provider-fanout/v1","provider-gate/v1","provider-targets/v1","system-launchdaemon/v1"],"minimum_version":"0.3.0"},"selection_sequence":1,"upgrade_from":[]},{"channel":"stable","components":[{"identity":"forge-runtime","requires_capabilities":["composition/v3","provider-targets/v1","system-launchdaemon/v1"]}],"composition_id":"forge-only-2.7.39","manifest":{"digest":"sha256:54c1dbe391ff5e57b2107cf439c3f9ef21f9f73da71e2862fbd8b71f9594947d","url":"https://github.com/autonomous-engineering-system/forge-platform/releases/download/forge-platform-composition-catalog-v1/ForgePlatformComposition-1-3.json"},"requires_installer":{"capabilities":["catalog-component-set/v1","composition/v3","managed-deployment/v1","managed-python-runtime/v1","provider-fanout/v1","provider-gate/v1","provider-targets/v1","system-launchdaemon/v1"],"minimum_version":"0.3.0"},"selection_sequence":1,"upgrade_from":[]}],"expires_at":"2026-11-01T08:30:00Z","published_at":"2026-10-01T08:30:00Z","schema":"forge-platform.component-combination-catalog/v1","sequence":1}